{
  "schema_version": "1.0",
  "job_id": "job-repair-c0-001",
  "trace_id": "trace-a01-demo-repair-001",
  "job_type": "REPAIR",
  "status": "SUCCEEDED",
  "input": {
    "repository": {
      "url": "https://example.invalid/devops-a01/md-rd-project.git",
      "commit": "00000000000000000000000000000000000000c0"
    },
    "md_report_uri": "artifact://pair-A01-B01/job-full-c0-001/md-report.json",
    "environment": {
      "image": "pair-a01-b01/demo-build:mock-1",
      "configuration_id": "cc-MODE0"
    },
    "target_file": "Makefile",
    "build_command": "make -j2",
    "verify_command": "make test"
  },
  "output": {
    "decision": "ACCEPTED",
    "artifacts": [
      {
        "artifact_id": "patch-c0-001",
        "type": "PATCH",
        "uri": "artifact://pair-A01-B01/job-repair-c0-001/fix.patch",
        "media_type": "text/x-diff",
        "producer_job_id": "job-repair-c0-001",
        "commit": "00000000000000000000000000000000000000c0",
        "configuration_id": "cc-MODE0"
      },
      {
        "artifact_id": "patch-notes-c0-001",
        "type": "PATCH_NOTES",
        "uri": "artifact://pair-A01-B01/job-repair-c0-001/patch-notes.md",
        "media_type": "text/markdown",
        "producer_job_id": "job-repair-c0-001",
        "commit": "00000000000000000000000000000000000000c0",
        "configuration_id": "cc-MODE0"
      },
      {
        "artifact_id": "build-log-repair-c0-001",
        "type": "BUILD_LOG",
        "uri": "artifact://pair-A01-B01/job-repair-c0-001/build.log",
        "media_type": "text/plain",
        "producer_job_id": "job-repair-c0-001",
        "commit": "00000000000000000000000000000000000000c0",
        "configuration_id": "cc-MODE0"
      },
      {
        "artifact_id": "test-report-repair-c0-001",
        "type": "TEST_REPORT",
        "uri": "artifact://pair-A01-B01/job-repair-c0-001/verify.json",
        "media_type": "application/json",
        "producer_job_id": "job-repair-c0-001",
        "commit": "00000000000000000000000000000000000000c0",
        "configuration_id": "cc-MODE0"
      }
    ]
  },
  "error": null,
  "provenance": "MOCK_FIXTURE"
}
